{
    "URL": "https://comp-ui-perf.skia.org",
    "contact": "https://bugs.skia.org",
    "auth_config": {
        "header_name": "X-WEBAUTH-USER",
        "login_url": "https://skia.org/login/",
        "logout_url": "https://skia.org/logout/"
    },
    "data_store_config": {
        "datastore_type": "cockroachdb",
        "connection_string": "postgresql://root@perf-cockroachdb-public:26257/compui?sslmode=disable",
        "tile_size": 256,
        "enable_follower_reads": true
    },
    "ingestion_config": {
        "source_config": {
            "source_type": "gcs",
            "project": "skia-public",
            "topic": "perf-ingestion-compui",
            "subscription": "perf-ingestion-compui-prod",
            "sources": [
                "gs://chrome-comp-ui-perf-skia/ingest"
            ]
        },
        "branches": [],
        "file_ingestion_pubsub_topic_name": ""
    },
    "git_repo_config": {
        "git_auth_type": "gerrit",
        "url": "https://skia.googlesource.com/perf-compui",
        "dir": "/tmp/compui-perf",
        "debounce_commit_url": false,
        "file_change_marker": ""
    }
}