{
  "URL": "https://v8-perf.skia.org",
  "contact": "https://bugs.chromium.org/p/v8/issues/list?q=component%3ATools&can=2",
  "auth_config": {
    "header_name": "X-WEBAUTH-USER",
    "login_url": "https://skia.org/login/",
    "logout_url": "https://skia.org/logout/"
  },
  "data_store_config": {
    "datastore_type": "cockroachdb",
    "connection_string": "postgresql://root@perf-cockroachdb-public:26257/v8?sslmode=disable",
    "tile_size": 256
  },
  "ingestion_config": {
    "source_config": {
      "source_type": "gcs",
      "project": "skia-public",
      "topic": "perf-ingestion-v8-production",
      "subscription": "",
      "sources": [
        "gs://v8_perf_skia_prod/v8/cq/",
        "gs://v8_perf_skia_prod/v8/chromeperf/"
      ]
    },
    "branches": [],
    "file_ingestion_pubsub_topic_name": ""
  },
  "git_repo_config": {
    "url": "https://chromium.googlesource.com/v8/v8.git",
    "dir": "/tmp/v8",
    "debounce_commit_url": false
  }
}