{
  "URL": "https://androidx-perf.skia.org/",
  "contact": "http://go/androidx-discuss",
  "auth_config": {
    "header_name": "X-WEBAUTH-USER",
    "login_url": "https://skia.org/login/",
    "logout_url": "https://skia.org/logout/"
  },
  "data_store_config": {
    "datastore_type": "cockroachdb",
    "connection_string": "postgresql://root@perf-cockroachdb-public:26257/android_x?sslmode=disable",
    "tile_size": 512
  },
  "ingestion_config": {
    "source_config": {
      "source_type": "gcs",
      "project": "skia-public",
      "topic": "perf-ingestion-android-x-production",
      "subscription": "",
      "sources": [
        "gs://skia-perf/android-master-ingest"
      ],
      "reject_if_name_matches": "/tx_log/",
      "accept_if_name_matches": "androidx"
    },
    "branches": [
      "aosp-androidx-master-dev",
      "aosp-androidx-main",
      "git_androidx-studio-integration"
    ],
    "file_ingestion_pubsub_topic_name": ""
  },
  "git_repo_config": {
    "git_auth_type": "gerrit",
    "url": "https://skia.googlesource.com/perf-buildid/android-master",
    "dir": "/tmp/androidx",
    "debounce_commit_url": true
  }
}